condition_name,condition_slug,symptom_names,symptom_slugs,symptom_probabilities,text,num_symptoms,max_symptom_probability,mean_symptom_probability,urgent_score,gp_score,self_score,label,override_applied,text_len_words,label_numeric
Peripheral nerve disorder,peripheral-nerve-disorder,"['Loss of sensation', 'Leg pain', 'Paresthesia', 'Foot or toe pain', 'Dizziness', 'Back pain', 'Problems with movement']","['loss-of-sensation', 'leg-pain', 'paresthesia', 'foot-or-toe-pain', 'dizziness', 'back-pain', 'problems-with-movement']","[69, 52, 46, 45, 27, 25, 23]","Condition: Peripheral nerve disorder. Patient reports: Loss of sensation, Leg pain, Paresthesia, Foot or toe pain, Dizziness, Back pain, Problems with movement.",7,69,41.0,0,2,0,consult_gp,False,22,1
Angina,angina,"['Sharp chest pain', 'Shortness of breath', 'Chest tightness', 'Dizziness', 'Arm pain', 'Lower body pain', 'Palpitations']","['sharp-chest-pain', 'shortness-of-breath', 'chest-tightness', 'dizziness', 'arm-pain', 'lower-body-pain', 'palpitations']","[92, 59, 40, 31, 28, 15, 11]","Condition: Angina. Patient reports: Sharp chest pain, Shortness of breath, Chest tightness, Dizziness, Arm pain, Lower body pain, Palpitations.",7,92,39.42857142857143,3,2,0,urgent,False,19,2
Broken tooth,broken-tooth,"['Toothache', 'Facial pain', 'Gum pain', 'Lip swelling', 'Mouth pain', 'Bleeding in mouth', 'Peripheral edema']","['toothache', 'facial-pain', 'gum-pain', 'lip-swelling', 'mouth-pain', 'bleeding-in-mouth', 'peripheral-edema']","[88, 37, 25, 14, 14, 14, 14]","Condition: Broken tooth. Patient reports: Toothache, Facial pain, Gum pain, Lip swelling, Mouth pain, Bleeding in mouth, Peripheral edema.",7,88,29.428571428571427,0,1,0,consult_gp,False,19,1
Astigmatism,astigmatism,"['Diminished vision', 'Symptoms of eye', 'Lacrimation', 'Spots or clouds in vision', 'Eye redness', 'Itchiness of eye', 'Pain in eye']","['diminished-vision', 'symptoms-of-eye', 'lacrimation', 'spots-or-clouds-in-vision', 'eye-redness', 'itchiness-of-eye', 'pain-in-eye']","[70, 29, 24, 20, 16, 16, 16]","Condition: Astigmatism. Patient reports: Diminished vision, Symptoms of eye, Lacrimation, Spots or clouds in vision, Eye redness, Itchiness of eye, Pain in eye.",7,70,27.285714285714285,0,0,0,self_monitor,False,23,0
Vaginal yeast infection,vaginal-yeast-infection,"['Vaginal itching', 'Vaginal discharge', 'Painful urination', 'Sharp abdominal pain', 'Vaginal pain', 'Vaginal redness', 'Itching of skin']","['vaginal-itching', 'vaginal-discharge', 'painful-urination', 'sharp-abdominal-pain', 'vaginal-pain', 'vaginal-redness', 'itching-of-skin']","[79, 77, 41, 32, 24, 23, 20]","Condition: Vaginal yeast infection. Patient reports: Vaginal itching, Vaginal discharge, Painful urination, Sharp abdominal pain, Vaginal pain, Vaginal redness, Itching of skin.",7,79,42.285714285714285,0,2,0,consult_gp,False,22,1
Cat scratch disease,cat-scratch-disease,"['Neck swelling', 'Skin swelling', 'Groin mass', 'Skin rash', 'Loss of sensation', 'Arm swelling', 'Skin lesion']","['neck-swelling', 'skin-swelling', 'groin-mass', 'skin-rash', 'loss-of-sensation', 'arm-swelling', 'skin-lesion']","[74, 74, 57, 57, 57, 57, 57]","Condition: Cat scratch disease. Patient reports: Neck swelling, Skin swelling, Groin mass, Skin rash, Loss of sensation, Arm swelling, Skin lesion.",7,74,61.85714285714285,0,1,0,consult_gp,False,21,1
Muscle spasm,muscle-spasm,"['Neck pain', 'Back pain', 'Shoulder pain', 'Leg pain', 'Headache', 'Leg cramps or spasms', 'Low back pain']","['neck-pain', 'back-pain', 'shoulder-pain', 'leg-pain', 'headache', 'leg-cramps-or-spasms', 'low-back-pain']","[68, 62, 51, 51, 43, 38, 38]","Condition: Muscle spasm. Patient reports: Neck pain, Back pain, Shoulder pain, Leg pain, Headache, Leg cramps or spasms, Low back pain.",7,68,50.142857142857146,0,2,0,consult_gp,False,21,1
Subconjunctival hemorrhage,subconjunctival-hemorrhage,"['Pain in eye', 'Eye redness', 'Diminished vision', 'Symptoms of eye', 'Headache', 'Swollen eye', 'Bleeding from eye']","['pain-in-eye', 'eye-redness', 'diminished-vision', 'symptoms-of-eye', 'headache', 'swollen-eye', 'bleeding-from-eye']","[70, 67, 39, 36, 35, 35, 32]","Condition: Subconjunctival hemorrhage. Patient reports: Pain in eye, Eye redness, Diminished vision, Symptoms of eye, Headache, Swollen eye, Bleeding from eye.",7,70,44.85714285714285,0,1,0,consult_gp,False,21,1
Chagas disease,chagas-disease,"['Pain in eye', 'Shoulder cramps or spasms', 'Facial pain', 'Ankle pain', 'Wrist pain', 'Pain during pregnancy', 'Excessive anger']","['pain-in-eye', 'shoulder-cramps-or-spasms', 'facial-pain', 'ankle-pain', 'wrist-pain', 'pain-during-pregnancy', 'excessive-anger']","[32, 32, 32, 32, 32, 32, 32]","Condition: Chagas disease. Patient reports: Pain in eye, Shoulder cramps or spasms, Facial pain, Ankle pain, Wrist pain, Pain during pregnancy, Excessive anger.",7,32,32.0,0,0,0,self_monitor,False,23,0
Paroxysmal supraventricular tachycardia,paroxysmal-supraventricular-tachycardia,"['Palpitations', 'Sharp chest pain', 'Increased heart rate', 'Irregular heartbeat', 'Shortness of breath', 'Dizziness', 'Weakness']","['palpitations', 'sharp-chest-pain', 'increased-heart-rate', 'irregular-heartbeat', 'shortness-of-breath', 'dizziness', 'weakness']","[72, 70, 67, 50, 48, 42, 21]","Condition: Paroxysmal supraventricular tachycardia. Patient reports: Palpitations, Sharp chest pain, Increased heart rate, Irregular heartbeat, Shortness of breath, Dizziness, Weakness.",7,72,52.85714285714285,2,2,0,urgent,False,20,2
Decubitus ulcer,decubitus-ulcer,"['Skin lesion', 'Difficulty speaking', 'Skin on leg or foot looks infected', 'Skin pain', 'Incontinence of stool', 'Penis redness', 'Disturbance of smell or taste']","['skin-lesion', 'difficulty-speaking', 'skin-on-leg-or-foot-looks-infected', 'skin-pain', 'incontinence-of-stool', 'penis-redness', 'disturbance-of-smell-or-taste']","[78, 11, 6, 1, 1, 1, 1]","Condition: Decubitus ulcer. Patient reports: Skin lesion, Difficulty speaking, Skin on leg or foot looks infected, Skin pain, Incontinence of stool, Penis redness, Disturbance of smell or taste.",7,78,14.142857142857142,0,0,0,self_monitor,False,28,0
Pain after an operation,pain-after-an-operation,"['Sharp abdominal pain', 'Back pain', 'Sharp chest pain', 'Headache', 'Nausea', 'Vomiting', 'Low back pain']","['sharp-abdominal-pain', 'back-pain', 'sharp-chest-pain', 'headache', 'nausea', 'vomiting', 'low-back-pain']","[68, 64, 61, 51, 48, 44, 41]","Condition: Pain after an operation. Patient reports: Sharp abdominal pain, Back pain, Sharp chest pain, Headache, Nausea, Vomiting, Low back pain.",7,68,53.85714285714285,1,4,0,urgent,False,21,2
Uveitis,uveitis,"['Diminished vision', 'Symptoms of eye', 'Upper abdominal pain', 'Eye redness', 'Elbow cramps or spasms', 'Wrist weakness', 'Nailbiting']","['diminished-vision', 'symptoms-of-eye', 'upper-abdominal-pain', 'eye-redness', 'elbow-cramps-or-spasms', 'wrist-weakness', 'nailbiting']","[74, 57, 57, 57, 5, 5, 5]","Condition: Uveitis. Patient reports: Diminished vision, Symptoms of eye, Upper abdominal pain, Eye redness, Elbow cramps or spasms, Wrist weakness, Nailbiting.",7,74,37.142857142857146,0,1,0,consult_gp,False,21,1
Tic (movement) disorder,tic-movement-disorder,"['Abnormal involuntary movements', 'Headache', 'Abnormal movement of eyelid', 'Seizures', 'Depressive or psychotic symptoms', 'Symptoms of eye', 'Problems with movement']","['abnormal-involuntary-movements', 'headache', 'abnormal-movement-of-eyelid', 'seizures', 'depressive-or-psychotic-symptoms', 'symptoms-of-eye', 'problems-with-movement']","[90, 49, 36, 25, 25, 18, 10]","Condition: Tic (movement) disorder. Patient reports: Abnormal involuntary movements, Headache, Abnormal movement of eyelid, Seizures, Depressive or psychotic symptoms, Symptoms of eye, Problems with movement.",7,90,36.142857142857146,1,1,0,urgent,False,25,2
Conversion disorder,conversion-disorder,"['Seizures', 'Depression', 'Sweating', 'Allergic reaction', 'Weakness', 'Sore throat', 'Anxiety and nervousness']","['seizures', 'depression', 'sweating', 'allergic-reaction', 'weakness', 'sore-throat', 'anxiety-and-nervousness']","[69, 58, 40, 40, 40, 40, 40]","Condition: Conversion disorder. Patient reports: Seizures, Depression, Sweating, Allergic reaction, Weakness, Sore throat, Anxiety and nervousness.",7,69,46.71428571428572,1,1,0,urgent,False,16,2
Fluid overload,fluid-overload,"['Shortness of breath', 'Peripheral edema', 'Sharp abdominal pain', 'Fluid retention', 'Leg swelling', 'Nausea', 'Difficulty breathing']","['shortness-of-breath', 'peripheral-edema', 'sharp-abdominal-pain', 'fluid-retention', 'leg-swelling', 'nausea', 'difficulty-breathing']","[84, 58, 47, 44, 35, 35, 35]","Condition: Fluid overload. Patient reports: Shortness of breath, Peripheral edema, Sharp abdominal pain, Fluid retention, Leg swelling, Nausea, Difficulty breathing.",7,84,48.285714285714285,2,2,0,urgent,False,20,2
Fracture of the neck,fracture-of-the-neck,"['Hip pain', 'Low back pain', 'Leg pain', 'Groin pain', 'Side pain', 'Elbow pain', 'Lower body pain']","['hip-pain', 'low-back-pain', 'leg-pain', 'groin-pain', 'side-pain', 'elbow-pain', 'lower-body-pain']","[83, 36, 29, 22, 22, 22, 12]","Condition: Fracture of the neck. Patient reports: Hip pain, Low back pain, Leg pain, Groin pain, Side pain, Elbow pain, Lower body pain.",7,83,32.285714285714285,0,1,0,consult_gp,False,23,1
Encephalitis,encephalitis,"['Headache', 'Loss of sensation', 'Seizures', 'Dizziness', 'Leg pain', 'Fatigue', 'Disturbance of memory']","['headache', 'loss-of-sensation', 'seizures', 'dizziness', 'leg-pain', 'fatigue', 'disturbance-of-memory']","[62, 53, 53, 39, 39, 30, 30]","Condition: Encephalitis. Patient reports: Headache, Loss of sensation, Seizures, Dizziness, Leg pain, Fatigue, Disturbance of memory.",7,62,43.71428571428572,1,3,0,urgent,True,16,2
Gastrointestinal hemorrhage,gastrointestinal-hemorrhage,"['Blood in stool', 'Rectal bleeding', 'Sharp abdominal pain', 'Melena', 'Vomiting', 'Diarrhea', 'Vomiting blood']","['blood-in-stool', 'rectal-bleeding', 'sharp-abdominal-pain', 'melena', 'vomiting', 'diarrhea', 'vomiting-blood']","[75, 68, 53, 51, 46, 45, 43]","Condition: Gastrointestinal hemorrhage. Patient reports: Blood in stool, Rectal bleeding, Sharp abdominal pain, Melena, Vomiting, Diarrhea, Vomiting blood.",7,75,54.42857142857143,2,3,0,urgent,True,18,2
Hypoglycemia,hypoglycemia,"['Depressive or psychotic symptoms', 'Weakness', 'Dizziness', 'Fainting', 'Nausea', 'Seizures', 'Abnormal involuntary movements']","['depressive-or-psychotic-symptoms', 'weakness', 'dizziness', 'fainting', 'nausea', 'seizures', 'abnormal-involuntary-movements']","[49, 45, 39, 27, 25, 21, 17]","Condition: Hypoglycemia. Patient reports: Depressive or psychotic symptoms, Weakness, Dizziness, Fainting, Nausea, Seizures, Abnormal involuntary movements.",7,49,31.857142857142858,2,1,0,urgent,False,16,2
Pinguecula,pinguecula,"['Symptoms of eye', 'Lacrimation', 'Double vision', 'Headache', 'Spots or clouds in vision', 'Sleepiness', 'Paresthesia']","['symptoms-of-eye', 'lacrimation', 'double-vision', 'headache', 'spots-or-clouds-in-vision', 'sleepiness', 'paresthesia']","[65, 46, 30, 30, 30, 30, 30]","Condition: Pinguecula. Patient reports: Symptoms of eye, Lacrimation, Double vision, Headache, Spots or clouds in vision, Sleepiness, Paresthesia.",7,65,37.285714285714285,0,1,0,consult_gp,False,18,1
Noninfectious gastroenteritis,noninfectious-gastroenteritis,"['Vomiting', 'Diarrhea', 'Nausea', 'Sharp abdominal pain', 'Fever', 'Burning abdominal pain', 'Headache']","['vomiting', 'diarrhea', 'nausea', 'sharp-abdominal-pain', 'fever', 'burning-abdominal-pain', 'headache']","[93, 88, 75, 72, 58, 40, 25]","Condition: Noninfectious gastroenteritis. Patient reports: Vomiting, Diarrhea, Nausea, Sharp abdominal pain, Fever, Burning abdominal pain, Headache.",7,93,64.42857142857143,0,5,0,consult_gp,False,16,1
Cirrhosis,cirrhosis,"['Sharp abdominal pain', 'Shortness of breath', 'Peripheral edema', 'Fatigue', 'Upper abdominal pain', 'Abdominal distention', 'Stomach bloating']","['sharp-abdominal-pain', 'shortness-of-breath', 'peripheral-edema', 'fatigue', 'upper-abdominal-pain', 'abdominal-distention', 'stomach-bloating']","[39, 30, 24, 20, 20, 16, 10]","Condition: Cirrhosis. Patient reports: Sharp abdominal pain, Shortness of breath, Peripheral edema, Fatigue, Upper abdominal pain, Abdominal distention, Stomach bloating.",7,39,22.714285714285715,1,3,1,urgent,False,20,2
Stroke,stroke,"['Focal weakness', 'Dizziness', 'Headache', 'Loss of sensation', 'Weakness', 'Problems with movement', 'Slurring words']","['focal-weakness', 'dizziness', 'headache', 'loss-of-sensation', 'weakness', 'problems-with-movement', 'slurring-words']","[46, 43, 37, 37, 33, 33, 30]","Condition: Stroke. Patient reports: Focal weakness, Dizziness, Headache, Loss of sensation, Weakness, Problems with movement, Slurring words.",7,46,37.0,0,2,0,urgent,True,17,2
Open wound due to trauma,open-wound-due-to-trauma,"['Skin on arm or hand looks infected', 'Wrist swelling', 'Shoulder stiffness or tightness']","['skin-on-arm-or-hand-looks-infected', 'wrist-swelling', 'shoulder-stiffness-or-tightness']","[2, 1, 1]","Condition: Open wound due to trauma. Patient reports: Skin on arm or hand looks infected, Wrist swelling, Shoulder stiffness or tightness.",3,2,1.3333333333333333,0,0,0,self_monitor,False,21,0
Drug abuse (opioids),drug-abuse-opioids,"['Drug abuse', 'Depressive or psychotic symptoms', 'Depression', 'Anxiety and nervousness', 'Abusing alcohol', 'Insomnia', 'Delusions or hallucinations']","['drug-abuse', 'depressive-or-psychotic-symptoms', 'depression', 'anxiety-and-nervousness', 'abusing-alcohol', 'insomnia', 'delusions-or-hallucinations']","[67, 46, 40, 35, 30, 13, 8]","Condition: Drug abuse (opioids). Patient reports: Drug abuse, Depressive or psychotic symptoms, Depression, Anxiety and nervousness, Abusing alcohol, Insomnia, Delusions or hallucinations.",7,67,34.142857142857146,0,0,0,self_monitor,False,22,0
Vitreous hemorrhage,vitreous-hemorrhage,"['Diminished vision', 'Spots or clouds in vision', 'Blindness', 'Symptoms of eye', 'Pain in eye', 'Bleeding from eye', 'Lacrimation']","['diminished-vision', 'spots-or-clouds-in-vision', 'blindness', 'symptoms-of-eye', 'pain-in-eye', 'bleeding-from-eye', 'lacrimation']","[83, 72, 40, 35, 30, 30, 10]","Condition: Vitreous hemorrhage. Patient reports: Diminished vision, Spots or clouds in vision, Blindness, Symptoms of eye, Pain in eye, Bleeding from eye, Lacrimation.",7,83,42.85714285714285,0,0,0,self_monitor,False,23,0
Crushing injury,crushing-injury,"['Hand or finger pain', 'Foot or toe pain', 'Loss of sensation', 'Hand or finger swelling', 'Hand or finger stiffness or tightness', 'Ankle swelling', 'Knee swelling']","['hand-or-finger-pain', 'foot-or-toe-pain', 'loss-of-sensation', 'hand-or-finger-swelling', 'hand-or-finger-stiffness-or-tightness', 'ankle-swelling', 'knee-swelling']","[62, 30, 22, 22, 12, 8, 8]","Condition: Crushing injury. Patient reports: Hand or finger pain, Foot or toe pain, Loss of sensation, Hand or finger swelling, Hand or finger stiffness or tightness, Ankle swelling, Knee swelling.",7,62,23.428571428571427,0,0,0,self_monitor,False,30,0
Retinal detachment,retinal-detachment,"['Spots or clouds in vision', 'Diminished vision', 'Blindness', 'Symptoms of eye', 'Pain in eye', 'Itchiness of eye', 'Eye burns or stings']","['spots-or-clouds-in-vision', 'diminished-vision', 'blindness', 'symptoms-of-eye', 'pain-in-eye', 'itchiness-of-eye', 'eye-burns-or-stings']","[66, 64, 39, 32, 22, 15, 10]","Condition: Retinal detachment. Patient reports: Spots or clouds in vision, Diminished vision, Blindness, Symptoms of eye, Pain in eye, Itchiness of eye, Eye burns or stings.",7,66,35.42857142857143,0,0,0,self_monitor,False,26,0
Intracranial abscess,intracranial-abscess,"['Seizures', 'Fever', 'Back pain', 'Headache', 'Low back pain', 'Depressive or psychotic symptoms', 'Leg pain']","['seizures', 'fever', 'back-pain', 'headache', 'low-back-pain', 'depressive-or-psychotic-symptoms', 'leg-pain']","[68, 58, 58, 58, 58, 40, 40]","Condition: Intracranial abscess. Patient reports: Seizures, Fever, Back pain, Headache, Low back pain, Depressive or psychotic symptoms, Leg pain.",7,68,54.285714285714285,1,3,0,urgent,False,19,2
Anemia of chronic disease,anemia-of-chronic-disease,"['Weakness', 'Diarrhea', 'Fatigue', 'Dizziness', 'Vomiting', 'Weight gain', 'Chills']","['weakness', 'diarrhea', 'fatigue', 'dizziness', 'vomiting', 'weight-gain', 'chills']","[52, 34, 34, 34, 34, 20, 20]","Condition: Anemia of chronic disease. Patient reports: Weakness, Diarrhea, Fatigue, Dizziness, Vomiting, Weight gain, Chills.",7,52,32.57142857142857,0,4,0,consult_gp,False,15,1
Deviated nasal septum,deviated-nasal-septum,"['Nasal congestion', 'Abnormal breathing sounds', 'Headache', 'Allergic reaction', 'Difficulty breathing', 'Painful sinuses', 'Apnea']","['nasal-congestion', 'abnormal-breathing-sounds', 'headache', 'allergic-reaction', 'difficulty-breathing', 'painful-sinuses', 'apnea']","[79, 43, 36, 35, 34, 29, 27]","Condition: Deviated nasal septum. Patient reports: Nasal congestion, Abnormal breathing sounds, Headache, Allergic reaction, Difficulty breathing, Painful sinuses, Apnea.",7,79,40.42857142857143,1,1,1,urgent,False,19,2
Acute fatty liver of pregnancy (AFLP),acute-fatty-liver-of-pregnancy-aflp,"['Pain during pregnancy', 'Sharp abdominal pain', 'Itching of skin', 'Eye strain', 'Wrist weakness', 'Itchy eyelid', 'Nailbiting']","['pain-during-pregnancy', 'sharp-abdominal-pain', 'itching-of-skin', 'eye-strain', 'wrist-weakness', 'itchy-eyelid', 'nailbiting']","[51, 51, 51, 4, 4, 4, 4]","Condition: Acute fatty liver of pregnancy (AFLP). Patient reports: Pain during pregnancy, Sharp abdominal pain, Itching of skin, Eye strain, Wrist weakness, Itchy eyelid, Nailbiting.",7,51,24.142857142857142,0,1,0,consult_gp,False,25,1
Alopecia,alopecia,"['Too little hair', 'Irregular appearing scalp', 'Skin rash', 'Skin swelling', 'Abnormal appearing skin', 'Dry or flaky scalp', 'Acne or pimples']","['too-little-hair', 'irregular-appearing-scalp', 'skin-rash', 'skin-swelling', 'abnormal-appearing-skin', 'dry-or-flaky-scalp', 'acne-or-pimples']","[94, 28, 26, 19, 19, 16, 16]","Condition: Alopecia. Patient reports: Too little hair, Irregular appearing scalp, Skin rash, Skin swelling, Abnormal appearing skin, Dry or flaky scalp, Acne or pimples.",7,94,31.142857142857142,0,1,0,consult_gp,False,24,1
Osteoarthritis,osteoarthritis,"['Knee pain', 'Hip pain', 'Shoulder pain', 'Back pain', 'Leg pain', 'Hand or finger pain', 'Joint pain']","['knee-pain', 'hip-pain', 'shoulder-pain', 'back-pain', 'leg-pain', 'hand-or-finger-pain', 'joint-pain']","[77, 41, 41, 33, 31, 26, 22]","Condition: Osteoarthritis. Patient reports: Knee pain, Hip pain, Shoulder pain, Back pain, Leg pain, Hand or finger pain, Joint pain.",7,77,38.71428571428572,0,2,0,self_monitor,True,20,0
Esophagitis,esophagitis,"['Sharp chest pain', 'Sharp abdominal pain', 'Vomiting', 'Difficulty in swallowing', 'Nausea', 'Heartburn', 'Upper abdominal pain']","['sharp-chest-pain', 'sharp-abdominal-pain', 'vomiting', 'difficulty-in-swallowing', 'nausea', 'heartburn', 'upper-abdominal-pain']","[66, 53, 50, 47, 40, 39, 33]","Condition: Esophagitis. Patient reports: Sharp chest pain, Sharp abdominal pain, Vomiting, Difficulty in swallowing, Nausea, Heartburn, Upper abdominal pain.",7,66,46.85714285714285,1,2,1,urgent,False,19,2
Acne,acne,"['Acne or pimples', 'Skin rash', 'Abnormal appearing skin', 'Skin moles', 'Skin swelling', 'Skin growth', 'Warts']","['acne-or-pimples', 'skin-rash', 'abnormal-appearing-skin', 'skin-moles', 'skin-swelling', 'skin-growth', 'warts']","[94, 38, 21, 20, 17, 13, 10]","Condition: Acne. Patient reports: Acne or pimples, Skin rash, Abnormal appearing skin, Skin moles, Skin swelling, Skin growth, Warts.",7,94,30.428571428571427,0,1,0,consult_gp,False,19,1
Frostbite,frostbite,"['Loss of sensation', 'Foot or toe pain', 'Ache all over', 'Hand or finger swelling', 'Sharp chest pain', 'Fainting', 'Back pain']","['loss-of-sensation', 'foot-or-toe-pain', 'ache-all-over', 'hand-or-finger-swelling', 'sharp-chest-pain', 'fainting', 'back-pain']","[55, 55, 37, 37, 37, 37, 37]","Condition: Frostbite. Patient reports: Loss of sensation, Foot or toe pain, Ache all over, Hand or finger swelling, Sharp chest pain, Fainting, Back pain.",7,55,42.142857142857146,2,1,0,urgent,False,24,2
Dislocation of the vertebra,dislocation-of-the-vertebra,"['Neck pain', 'Back pain', 'Low back pain', 'Bones are painful', 'Hand or finger pain', 'Leg pain', 'Loss of sensation']","['neck-pain', 'back-pain', 'low-back-pain', 'bones-are-painful', 'hand-or-finger-pain', 'leg-pain', 'loss-of-sensation']","[77, 70, 59, 41, 41, 41, 41]","Condition: Dislocation of the vertebra. Patient reports: Neck pain, Back pain, Low back pain, Bones are painful, Hand or finger pain, Leg pain, Loss of sensation.",7,77,52.85714285714285,0,1,0,consult_gp,False,26,1
Mastectomy,mastectomy,"['Lump or mass of breast', 'Pain or soreness of breast', 'Problems with shape or size of breast', 'Skin swelling', 'Arm stiffness or tightness', 'Smoking problems', 'Burning chest pain']","['lump-or-mass-of-breast', 'pain-or-soreness-of-breast', 'problems-with-shape-or-size-of-breast', 'skin-swelling', 'arm-stiffness-or-tightness', 'smoking-problems', 'burning-chest-pain']","[21, 21, 8, 8, 4, 4, 4]","Condition: Mastectomy. Patient reports: Lump or mass of breast, Pain or soreness of breast, Problems with shape or size of breast, Skin swelling, Arm stiffness or tightness, Smoking problems, Burning chest pain.",7,21,10.0,1,0,0,urgent,False,32,2
Dislocation of the foot,dislocation-of-the-foot,"['Foot or toe pain', 'Vomiting', 'Ankle pain', 'Knee weakness', 'Elbow weakness', 'Elbow cramps or spasms', 'Eye strain']","['foot-or-toe-pain', 'vomiting', 'ankle-pain', 'knee-weakness', 'elbow-weakness', 'elbow-cramps-or-spasms', 'eye-strain']","[78, 37, 37, 37, 3, 3, 3]","Condition: Dislocation of the foot. Patient reports: Foot or toe pain, Vomiting, Ankle pain, Knee weakness, Elbow weakness, Elbow cramps or spasms, Eye strain.",7,78,28.285714285714285,0,1,0,consult_gp,False,24,1
Peyronie disease,peyronie-disease,"['Impotence', 'Penis pain', 'Symptoms of prostate', 'Mass in scrotum', 'Frequent urination', 'Sweating', 'Infertility']","['impotence', 'penis-pain', 'symptoms-of-prostate', 'mass-in-scrotum', 'frequent-urination', 'sweating', 'infertility']","[67, 58, 34, 20, 20, 20, 20]","Condition: Peyronie disease. Patient reports: Impotence, Penis pain, Symptoms of prostate, Mass in scrotum, Frequent urination, Sweating, Infertility.",7,67,34.142857142857146,0,0,0,self_monitor,False,18,0
Foreign body in the throat,foreign-body-in-the-throat,"['Difficulty in swallowing', 'Vomiting', 'Sore throat', 'Cough', 'Shortness of breath', 'Difficulty breathing', 'Infant spitting up']","['difficulty-in-swallowing', 'vomiting', 'sore-throat', 'cough', 'shortness-of-breath', 'difficulty-breathing', 'infant-spitting-up']","[78, 58, 47, 43, 39, 39, 17]","Condition: Foreign body in the throat. Patient reports: Difficulty in swallowing, Vomiting, Sore throat, Cough, Shortness of breath, Difficulty breathing, Infant spitting up.",7,78,45.85714285714285,2,2,0,urgent,False,23,2
Smoking or tobacco addiction,smoking-or-tobacco-addiction,"['Smoking problems', 'Cough', 'Sharp chest pain', 'Shortness of breath', 'Headache', 'Drug abuse', 'Abusing alcohol']","['smoking-problems', 'cough', 'sharp-chest-pain', 'shortness-of-breath', 'headache', 'drug-abuse', 'abusing-alcohol']","[44, 42, 34, 31, 26, 25, 22]","Condition: Smoking or tobacco addiction. Patient reports: Smoking problems, Cough, Sharp chest pain, Shortness of breath, Headache, Drug abuse, Abusing alcohol.",7,44,32.0,2,1,0,urgent,False,21,2
Granuloma inguinale,granuloma-inguinale,"['Nausea', 'Sharp chest pain', 'Groin pain', 'Vaginal pain', 'Vulvar sore', 'Loss of sex drive', 'Knee lump or mass']","['nausea', 'sharp-chest-pain', 'groin-pain', 'vaginal-pain', 'vulvar-sore', 'loss-of-sex-drive', 'knee-lump-or-mass']","[77, 77, 77, 77, 11, 11, 11]","Condition: Granuloma inguinale. Patient reports: Nausea, Sharp chest pain, Groin pain, Vaginal pain, Vulvar sore, Loss of sex drive, Knee lump or mass.",7,77,48.71428571428572,1,0,0,urgent,False,23,2
Diabetic peripheral neuropathy,diabetic-peripheral-neuropathy,"['Skin lesion', 'Foot or toe pain', 'Loss of sensation', 'Leg pain', 'Paresthesia', 'Problems with movement', 'Foot or toe swelling']","['skin-lesion', 'foot-or-toe-pain', 'loss-of-sensation', 'leg-pain', 'paresthesia', 'problems-with-movement', 'foot-or-toe-swelling']","[48, 37, 33, 31, 22, 11, 9]","Condition: Diabetic peripheral neuropathy. Patient reports: Skin lesion, Foot or toe pain, Loss of sensation, Leg pain, Paresthesia, Problems with movement, Foot or toe swelling.",7,48,27.285714285714285,0,0,0,self_monitor,False,25,0
Acute kidney injury,acute-kidney-injury,"['Shortness of breath', 'Weakness', 'Vomiting', 'Dizziness', 'Nausea', 'Sharp abdominal pain', 'Sharp chest pain']","['shortness-of-breath', 'weakness', 'vomiting', 'dizziness', 'nausea', 'sharp-abdominal-pain', 'sharp-chest-pain']","[41, 39, 30, 29, 27, 26, 25]","Condition: Acute kidney injury. Patient reports: Shortness of breath, Weakness, Vomiting, Dizziness, Nausea, Sharp abdominal pain, Sharp chest pain.",7,41,31.0,2,3,0,urgent,False,19,2
Empyema,empyema,"['Cough', 'Shortness of breath', 'Hurts to breath', 'Back pain', 'Sharp chest pain', 'Coryza', 'Skin rash']","['cough', 'shortness-of-breath', 'hurts-to-breath', 'back-pain', 'sharp-chest-pain', 'coryza', 'skin-rash']","[69, 63, 44, 44, 44, 44, 28]","Condition: Empyema. Patient reports: Cough, Shortness of breath, Hurts to breath, Back pain, Sharp chest pain, Coryza, Skin rash.",7,69,48.0,2,2,0,urgent,False,19,2
