condition_name,condition_slug,symptom_names,symptom_slugs,symptom_probabilities,text,num_symptoms,max_symptom_probability,mean_symptom_probability,urgent_score,gp_score,self_score,label,override_applied,text_len_words,label_numeric
Dislocation of the hip,dislocation-of-the-hip,"['Hip pain', 'Knee pain', 'Leg pain', 'Back pain', 'Groin pain', 'Hip stiffness or tightness', 'Abusing alcohol']","['hip-pain', 'knee-pain', 'leg-pain', 'back-pain', 'groin-pain', 'hip-stiffness-or-tightness', 'abusing-alcohol']","[90, 24, 24, 24, 14, 14, 14]","Condition: Dislocation of the hip. Patient reports: Hip pain, Knee pain, Leg pain, Back pain, Groin pain, Hip stiffness or tightness, Abusing alcohol.",7,90,29.142857142857142,0,1,0,consult_gp,False,23,1
Vitamin D deficiency,vitamin-d-deficiency,"['Fatigue', 'Joint pain', 'Hot flashes', 'Weight gain', 'Skin irritation', 'Arm stiffness or tightness', 'Smoking problems']","['fatigue', 'joint-pain', 'hot-flashes', 'weight-gain', 'skin-irritation', 'arm-stiffness-or-tightness', 'smoking-problems']","[40, 9, 9, 9, 3, 3, 3]","Condition: Vitamin D deficiency. Patient reports: Fatigue, Joint pain, Hot flashes, Weight gain, Skin irritation, Arm stiffness or tightness, Smoking problems.",7,40,10.857142857142858,0,2,0,self_monitor,True,21,0
Ectropion,ectropion,"['Lacrimation', 'Pain in eye', 'Abnormal movement of eyelid', 'Symptoms of eye', 'Eye redness', 'Spots or clouds in vision', 'Eyelid lesion or rash']","['lacrimation', 'pain-in-eye', 'abnormal-movement-of-eyelid', 'symptoms-of-eye', 'eye-redness', 'spots-or-clouds-in-vision', 'eyelid-lesion-or-rash']","[72, 66, 58, 58, 47, 30, 30]","Condition: Ectropion. Patient reports: Lacrimation, Pain in eye, Abnormal movement of eyelid, Symptoms of eye, Eye redness, Spots or clouds in vision, Eyelid lesion or rash.",7,72,51.57142857142857,0,0,0,self_monitor,False,26,0
Cardiomyopathy,cardiomyopathy,"['Shortness of breath', 'Sharp chest pain', 'Fatigue', 'Peripheral edema', 'Palpitations', 'Chest tightness', 'Weight gain']","['shortness-of-breath', 'sharp-chest-pain', 'fatigue', 'peripheral-edema', 'palpitations', 'chest-tightness', 'weight-gain']","[53, 39, 27, 16, 13, 13, 9]","Condition: Cardiomyopathy. Patient reports: Shortness of breath, Sharp chest pain, Fatigue, Peripheral edema, Palpitations, Chest tightness, Weight gain.",7,53,24.285714285714285,3,3,0,urgent,False,18,2
Stye,stye,"['Pain in eye', 'Swollen eye', 'Eye redness', 'Eyelid swelling', 'Symptoms of eye', 'Mass on eyelid', 'Itchiness of eye']","['pain-in-eye', 'swollen-eye', 'eye-redness', 'eyelid-swelling', 'symptoms-of-eye', 'mass-on-eyelid', 'itchiness-of-eye']","[74, 73, 60, 56, 46, 35, 27]","Condition: Stye. Patient reports: Pain in eye, Swollen eye, Eye redness, Eyelid swelling, Symptoms of eye, Mass on eyelid, Itchiness of eye.",7,74,53.0,0,0,0,self_monitor,True,22,0
Alcohol intoxication,alcohol-intoxication,"['Abusing alcohol', 'Depressive or psychotic symptoms', 'Vomiting', 'Depression', 'Sharp abdominal pain', 'Sharp chest pain', 'Anxiety and nervousness']","['abusing-alcohol', 'depressive-or-psychotic-symptoms', 'vomiting', 'depression', 'sharp-abdominal-pain', 'sharp-chest-pain', 'anxiety-and-nervousness']","[79, 60, 41, 32, 29, 29, 25]","Condition: Alcohol intoxication. Patient reports: Abusing alcohol, Depressive or psychotic symptoms, Vomiting, Depression, Sharp abdominal pain, Sharp chest pain, Anxiety and nervousness.",7,79,42.142857142857146,1,2,0,urgent,False,22,2
Tendinitis,tendinitis,"['Hip pain', 'Shoulder pain', 'Knee pain', 'Wrist pain', 'Foot or toe pain', 'Hand or finger pain', 'Leg pain']","['hip-pain', 'shoulder-pain', 'knee-pain', 'wrist-pain', 'foot-or-toe-pain', 'hand-or-finger-pain', 'leg-pain']","[61, 54, 53, 48, 46, 45, 40]","Condition: Tendinitis. Patient reports: Hip pain, Shoulder pain, Knee pain, Wrist pain, Foot or toe pain, Hand or finger pain, Leg pain.",7,61,49.57142857142857,0,0,0,self_monitor,False,22,0
Cysticercosis,cysticercosis,"['Seizures', 'Headache', 'Vomiting', 'Shortness of breath', 'Abnormal involuntary movements', 'Elbow cramps or spasms', 'Elbow weakness']","['seizures', 'headache', 'vomiting', 'shortness-of-breath', 'abnormal-involuntary-movements', 'elbow-cramps-or-spasms', 'elbow-weakness']","[90, 87, 43, 43, 43, 3, 3]","Condition: Cysticercosis. Patient reports: Seizures, Headache, Vomiting, Shortness of breath, Abnormal involuntary movements, Elbow cramps or spasms, Elbow weakness.",7,90,44.57142857142857,2,2,0,urgent,False,19,2
Chronic inflammatory demyelinating polyneuropathy (CIDP),chronic-inflammatory-demyelinating-polyneuropathy-cidp,"['Loss of sensation', 'Weakness', 'Problems with movement', 'Leg weakness', 'Leg cramps or spasms', 'Abnormal involuntary movements', 'Facial pain']","['loss-of-sensation', 'weakness', 'problems-with-movement', 'leg-weakness', 'leg-cramps-or-spasms', 'abnormal-involuntary-movements', 'facial-pain']","[78, 67, 53, 53, 27, 27, 27]","Condition: Chronic inflammatory demyelinating polyneuropathy (CIDP). Patient reports: Loss of sensation, Weakness, Problems with movement, Leg weakness, Leg cramps or spasms, Abnormal involuntary movements, Facial pain.",7,78,47.42857142857143,1,0,0,urgent,False,26,2
Fracture of the shoulder,fracture-of-the-shoulder,"['Shoulder pain', 'Arm pain', 'Bones are painful', 'Arm stiffness or tightness', 'Shoulder swelling', 'Fluid retention', 'Shoulder stiffness or tightness']","['shoulder-pain', 'arm-pain', 'bones-are-painful', 'arm-stiffness-or-tightness', 'shoulder-swelling', 'fluid-retention', 'shoulder-stiffness-or-tightness']","[85, 28, 26, 10, 8, 8, 4]","Condition: Fracture of the shoulder. Patient reports: Shoulder pain, Arm pain, Bones are painful, Arm stiffness or tightness, Shoulder swelling, Fluid retention, Shoulder stiffness or tightness.",7,85,24.142857142857142,0,0,0,self_monitor,False,26,0
Carpal tunnel syndrome,carpal-tunnel-syndrome,"['Loss of sensation', 'Hand or finger pain', 'Wrist pain', 'Paresthesia', 'Arm pain', 'Neck pain', 'Hand or finger weakness']","['loss-of-sensation', 'hand-or-finger-pain', 'wrist-pain', 'paresthesia', 'arm-pain', 'neck-pain', 'hand-or-finger-weakness']","[80, 66, 57, 48, 45, 36, 11]","Condition: Carpal tunnel syndrome. Patient reports: Loss of sensation, Hand or finger pain, Wrist pain, Paresthesia, Arm pain, Neck pain, Hand or finger weakness.",7,80,49.0,0,0,0,self_monitor,True,24,0
Osteochondroma,osteochondroma,"['Knee pain', 'Foot or toe pain', 'Skin growth', 'Shoulder pain', 'Abnormal appearing skin', 'Skin lesion', 'Pelvic pain']","['knee-pain', 'foot-or-toe-pain', 'skin-growth', 'shoulder-pain', 'abnormal-appearing-skin', 'skin-lesion', 'pelvic-pain']","[48, 44, 32, 32, 26, 23, 23]","Condition: Osteochondroma. Patient reports: Knee pain, Foot or toe pain, Skin growth, Shoulder pain, Abnormal appearing skin, Skin lesion, Pelvic pain.",7,48,32.57142857142857,0,0,0,self_monitor,False,21,0
Diabetic retinopathy,diabetic-retinopathy,"['Diminished vision', 'Spots or clouds in vision', 'Pain in eye', 'Lacrimation', 'Symptoms of eye', 'Eye redness', 'Foreign body sensation in eye']","['diminished-vision', 'spots-or-clouds-in-vision', 'pain-in-eye', 'lacrimation', 'symptoms-of-eye', 'eye-redness', 'foreign-body-sensation-in-eye']","[71, 33, 25, 22, 21, 11, 11]","Condition: Diabetic retinopathy. Patient reports: Diminished vision, Spots or clouds in vision, Pain in eye, Lacrimation, Symptoms of eye, Eye redness, Foreign body sensation in eye.",7,71,27.714285714285715,0,0,0,self_monitor,False,26,0
Hirsutism,hirsutism,"['Unwanted hair', 'Unpredictable menstruation', 'Acne or pimples', 'Fatigue', 'Infertility', 'Abnormal appearing skin', 'Weight gain']","['unwanted-hair', 'unpredictable-menstruation', 'acne-or-pimples', 'fatigue', 'infertility', 'abnormal-appearing-skin', 'weight-gain']","[82, 32, 32, 23, 23, 23, 23]","Condition: Hirsutism. Patient reports: Unwanted hair, Unpredictable menstruation, Acne or pimples, Fatigue, Infertility, Abnormal appearing skin, Weight gain.",7,82,34.0,0,1,0,consult_gp,False,18,1
Urethral valves,urethral-valves,"['Side pain', 'Sharp abdominal pain', 'Lower abdominal pain', 'Suprapubic pain', 'Vomiting', 'Constipation', 'Blood in urine']","['side-pain', 'sharp-abdominal-pain', 'lower-abdominal-pain', 'suprapubic-pain', 'vomiting', 'constipation', 'blood-in-urine']","[67, 53, 42, 27, 27, 27, 27]","Condition: Urethral valves. Patient reports: Side pain, Sharp abdominal pain, Lower abdominal pain, Suprapubic pain, Vomiting, Constipation, Blood in urine.",7,67,38.57142857142857,0,3,0,consult_gp,False,20,1
Acariasis,acariasis,"['Skin rash', 'Itching of skin', 'Swelling of scrotum', 'Skin lesion', 'Vomiting', 'Elbow weakness', 'Cross-eyed']","['skin-rash', 'itching-of-skin', 'swelling-of-scrotum', 'skin-lesion', 'vomiting', 'elbow-weakness', 'cross-eyed']","[91, 77, 49, 49, 49, 4, 4]","Condition: Acariasis. Patient reports: Skin rash, Itching of skin, Swelling of scrotum, Skin lesion, Vomiting, Elbow weakness, Cross-eyed.",7,91,46.142857142857146,0,2,0,consult_gp,False,18,1
Heart attack,heart-attack,"['Sharp chest pain', 'Shortness of breath', 'Chest tightness', 'Nausea', 'Arm pain', 'Fainting', 'Sweating']","['sharp-chest-pain', 'shortness-of-breath', 'chest-tightness', 'nausea', 'arm-pain', 'fainting', 'sweating']","[90, 56, 37, 25, 20, 17, 10]","Condition: Heart attack. Patient reports: Sharp chest pain, Shortness of breath, Chest tightness, Nausea, Arm pain, Fainting, Sweating.",7,90,36.42857142857143,4,0,0,urgent,True,18,2
Dry eye of unknown cause,dry-eye-of-unknown-cause,"['Symptoms of eye', 'Diminished vision', 'Pain in eye', 'Lacrimation', 'Itchiness of eye', 'Eye redness', 'Eye burns or stings']","['symptoms-of-eye', 'diminished-vision', 'pain-in-eye', 'lacrimation', 'itchiness-of-eye', 'eye-redness', 'eye-burns-or-stings']","[72, 69, 50, 46, 45, 44, 33]","Condition: Dry eye of unknown cause. Patient reports: Symptoms of eye, Diminished vision, Pain in eye, Lacrimation, Itchiness of eye, Eye redness, Eye burns or stings.",7,72,51.285714285714285,0,0,0,self_monitor,False,26,0
Polycystic ovarian syndrome (PCOS),polycystic-ovarian-syndrome-pcos,"['Infertility', 'Unpredictable menstruation', 'Weight gain', 'Pelvic pain', 'Absence of menstruation', 'Heavy menstrual flow', 'Intermenstrual bleeding']","['infertility', 'unpredictable-menstruation', 'weight-gain', 'pelvic-pain', 'absence-of-menstruation', 'heavy-menstrual-flow', 'intermenstrual-bleeding']","[47, 34, 27, 22, 19, 19, 16]","Condition: Polycystic ovarian syndrome (PCOS). Patient reports: Infertility, Unpredictable menstruation, Weight gain, Pelvic pain, Absence of menstruation, Heavy menstrual flow, Intermenstrual bleeding.",7,47,26.285714285714285,0,0,0,self_monitor,False,22,0
Chronic rheumatic fever,chronic-rheumatic-fever,"['Shortness of breath', 'Sharp chest pain', 'Palpitations', 'Difficulty breathing', 'Dizziness', 'Chest tightness', 'Increased heart rate']","['shortness-of-breath', 'sharp-chest-pain', 'palpitations', 'difficulty-breathing', 'dizziness', 'chest-tightness', 'increased-heart-rate']","[52, 42, 33, 26, 26, 15, 11]","Condition: Chronic rheumatic fever. Patient reports: Shortness of breath, Sharp chest pain, Palpitations, Difficulty breathing, Dizziness, Chest tightness, Increased heart rate.",7,52,29.285714285714285,4,2,0,urgent,False,21,2
Psychotic disorder,psychotic-disorder,"['Depressive or psychotic symptoms', 'Depression', 'Delusions or hallucinations', 'Anxiety and nervousness', 'Hostile behavior', 'Excessive anger', 'Insomnia']","['depressive-or-psychotic-symptoms', 'depression', 'delusions-or-hallucinations', 'anxiety-and-nervousness', 'hostile-behavior', 'excessive-anger', 'insomnia']","[74, 54, 45, 42, 35, 17, 16]","Condition: Psychotic disorder. Patient reports: Depressive or psychotic symptoms, Depression, Delusions or hallucinations, Anxiety and nervousness, Hostile behavior, Excessive anger, Insomnia.",7,74,40.42857142857143,0,0,0,self_monitor,True,21,0
Ulcerative colitis,ulcerative-colitis,"['Diarrhea', 'Sharp abdominal pain', 'Blood in stool', 'Nausea', 'Vomiting', 'Burning abdominal pain', 'Rectal bleeding']","['diarrhea', 'sharp-abdominal-pain', 'blood-in-stool', 'nausea', 'vomiting', 'burning-abdominal-pain', 'rectal-bleeding']","[65, 53, 40, 35, 33, 26, 23]","Condition: Ulcerative colitis. Patient reports: Diarrhea, Sharp abdominal pain, Blood in stool, Nausea, Vomiting, Burning abdominal pain, Rectal bleeding.",7,65,39.285714285714285,0,3,0,consult_gp,False,19,1
Hyperosmotic hyperketotic state,hyperosmotic-hyperketotic-state,"['Weakness', 'Thirst', 'Frequent urination', 'Cough', 'Sharp abdominal pain', 'Fainting', 'Burning chest pain']","['weakness', 'thirst', 'frequent-urination', 'cough', 'sharp-abdominal-pain', 'fainting', 'burning-chest-pain']","[60, 60, 49, 32, 32, 32, 32]","Condition: Hyperosmotic hyperketotic state. Patient reports: Weakness, Thirst, Frequent urination, Cough, Sharp abdominal pain, Fainting, Burning chest pain.",7,60,42.42857142857143,2,1,0,urgent,False,18,2
Joint effusion,joint-effusion,"['Knee pain', 'Knee swelling', 'Ankle pain', 'Ankle swelling', 'Elbow pain', 'Wrist pain', 'Elbow swelling']","['knee-pain', 'knee-swelling', 'ankle-pain', 'ankle-swelling', 'elbow-pain', 'wrist-pain', 'elbow-swelling']","[86, 64, 35, 23, 18, 14, 14]","Condition: Joint effusion. Patient reports: Knee pain, Knee swelling, Ankle pain, Ankle swelling, Elbow pain, Wrist pain, Elbow swelling.",7,86,36.285714285714285,0,0,0,self_monitor,False,19,0
Cryptococcosis,cryptococcosis,"['Lip swelling', 'Fainting', 'Seizures', 'Depressive or psychotic symptoms', 'Shoulder swelling', 'Nailbiting', 'Eye strain']","['lip-swelling', 'fainting', 'seizures', 'depressive-or-psychotic-symptoms', 'shoulder-swelling', 'nailbiting', 'eye-strain']","[63, 63, 63, 63, 7, 7, 7]","Condition: Cryptococcosis. Patient reports: Lip swelling, Fainting, Seizures, Depressive or psychotic symptoms, Shoulder swelling, Nailbiting, Eye strain.",7,63,39.0,2,0,0,urgent,False,17,2
Dissociative disorder,dissociative-disorder,"['Depressive or psychotic symptoms', 'Anxiety and nervousness', 'Depression', 'Low self-esteem', 'Excessive anger', 'Disturbance of memory', 'Delusions or hallucinations']","['depressive-or-psychotic-symptoms', 'anxiety-and-nervousness', 'depression', 'low-self-esteem', 'excessive-anger', 'disturbance-of-memory', 'delusions-or-hallucinations']","[83, 66, 66, 30, 30, 18, 18]","Condition: Dissociative disorder. Patient reports: Depressive or psychotic symptoms, Anxiety and nervousness, Depression, Low self-esteem, Excessive anger, Disturbance of memory, Delusions or hallucinations.",7,83,44.42857142857143,0,0,0,self_monitor,False,23,0
Alcoholic liver disease,alcoholic-liver-disease,"['Sharp abdominal pain', 'Abusing alcohol', 'Peripheral edema', 'Abdominal distention', 'Diarrhea', 'Abnormal involuntary movements', 'Vomiting blood']","['sharp-abdominal-pain', 'abusing-alcohol', 'peripheral-edema', 'abdominal-distention', 'diarrhea', 'abnormal-involuntary-movements', 'vomiting-blood']","[61, 50, 37, 28, 28, 22, 22]","Condition: Alcoholic liver disease. Patient reports: Sharp abdominal pain, Abusing alcohol, Peripheral edema, Abdominal distention, Diarrhea, Abnormal involuntary movements, Vomiting blood.",7,61,35.42857142857143,1,4,0,urgent,False,21,2
Scar,scar,"['Acne or pimples', 'Skin lesion', 'Abnormal appearing skin', 'Itching of skin', 'Skin growth', 'Skin moles', 'Skin dryness, peeling, scaliness, or roughness']","['acne-or-pimples', 'skin-lesion', 'abnormal-appearing-skin', 'itching-of-skin', 'skin-growth', 'skin-moles', 'skin-dryness-peeling-scaliness-or-roughness']","[34, 34, 26, 24, 19, 12, 12]","Condition: Scar. Patient reports: Acne or pimples, Skin lesion, Abnormal appearing skin, Itching of skin, Skin growth, Skin moles, Skin dryness, peeling, scaliness, or roughness.",7,34,23.0,0,0,0,self_monitor,False,25,0
Lymphadenitis,lymphadenitis,"['Sore throat', 'Fever', 'Sharp abdominal pain', 'Swollen lymph nodes', 'Neck pain', 'Neck mass', 'Neck swelling']","['sore-throat', 'fever', 'sharp-abdominal-pain', 'swollen-lymph-nodes', 'neck-pain', 'neck-mass', 'neck-swelling']","[60, 55, 53, 53, 50, 43, 40]","Condition: Lymphadenitis. Patient reports: Sore throat, Fever, Sharp abdominal pain, Swollen lymph nodes, Neck pain, Neck mass, Neck swelling.",7,60,50.57142857142857,0,3,0,consult_gp,False,19,1
Cervical cancer,cervical-cancer,"['Pelvic pain', 'Vaginal discharge', 'Heavy menstrual flow', 'Unpredictable menstruation', 'Vaginal itching', 'Intermenstrual bleeding', 'Painful menstruation']","['pelvic-pain', 'vaginal-discharge', 'heavy-menstrual-flow', 'unpredictable-menstruation', 'vaginal-itching', 'intermenstrual-bleeding', 'painful-menstruation']","[13, 11, 6, 5, 5, 5, 5]","Condition: Cervical cancer. Patient reports: Pelvic pain, Vaginal discharge, Heavy menstrual flow, Unpredictable menstruation, Vaginal itching, Intermenstrual bleeding, Painful menstruation.",7,13,7.142857142857143,0,0,0,self_monitor,False,20,0
Lead poisoning,lead-poisoning,"['Pain in eye', 'Shoulder cramps or spasms', 'Facial pain', 'Ankle pain', 'Wrist pain', 'Pain during pregnancy', 'Excessive anger']","['pain-in-eye', 'shoulder-cramps-or-spasms', 'facial-pain', 'ankle-pain', 'wrist-pain', 'pain-during-pregnancy', 'excessive-anger']","[91, 91, 91, 91, 91, 91, 91]","Condition: Lead poisoning. Patient reports: Pain in eye, Shoulder cramps or spasms, Facial pain, Ankle pain, Wrist pain, Pain during pregnancy, Excessive anger.",7,91,91.0,0,0,0,self_monitor,False,23,0
Acute bronchiolitis,acute-bronchiolitis,"['Cough', 'Fever', 'Nasal congestion', 'Wheezing', 'Difficulty breathing', 'Vomiting', 'Coryza']","['cough', 'fever', 'nasal-congestion', 'wheezing', 'difficulty-breathing', 'vomiting', 'coryza']","[91, 78, 76, 59, 56, 42, 41]","Condition: Acute bronchiolitis. Patient reports: Cough, Fever, Nasal congestion, Wheezing, Difficulty breathing, Vomiting, Coryza.",7,91,63.285714285714285,1,2,1,urgent,False,14,2
Injury to the abdomen,injury-to-the-abdomen,"['Sharp abdominal pain', 'Sharp chest pain', 'Back pain', 'Burning abdominal pain', 'Upper abdominal pain', 'Lower abdominal pain', 'Leg pain']","['sharp-abdominal-pain', 'sharp-chest-pain', 'back-pain', 'burning-abdominal-pain', 'upper-abdominal-pain', 'lower-abdominal-pain', 'leg-pain']","[68, 59, 45, 45, 45, 35, 35]","Condition: Injury to the abdomen. Patient reports: Sharp abdominal pain, Sharp chest pain, Back pain, Burning abdominal pain, Upper abdominal pain, Lower abdominal pain, Leg pain.",7,68,47.42857142857143,1,2,0,urgent,False,26,2
Poisoning due to antihypertensives,poisoning-due-to-antihypertensives,"['Depressive or psychotic symptoms', 'Dizziness', 'Itching of skin', 'Skin rash', 'Weakness', 'Diarrhea', 'Nausea']","['depressive-or-psychotic-symptoms', 'dizziness', 'itching-of-skin', 'skin-rash', 'weakness', 'diarrhea', 'nausea']","[52, 52, 41, 41, 41, 26, 26]","Condition: Poisoning due to antihypertensives. Patient reports: Depressive or psychotic symptoms, Dizziness, Itching of skin, Skin rash, Weakness, Diarrhea, Nausea.",7,52,39.85714285714285,0,3,0,consult_gp,False,20,1
Reactive arthritis,reactive-arthritis,"['Knee pain', 'Ache all over', 'Hip pain', 'Back pain', 'Vulvar sore', 'Loss of sex drive', 'Knee lump or mass']","['knee-pain', 'ache-all-over', 'hip-pain', 'back-pain', 'vulvar-sore', 'loss-of-sex-drive', 'knee-lump-or-mass']","[77, 77, 77, 77, 11, 11, 11]","Condition: Reactive arthritis. Patient reports: Knee pain, Ache all over, Hip pain, Back pain, Vulvar sore, Loss of sex drive, Knee lump or mass.",7,77,48.71428571428572,0,1,0,consult_gp,False,24,1
Fracture of the hand,fracture-of-the-hand,"['Hand or finger pain', 'Wrist pain', 'Hand or finger swelling', 'Arm pain', 'Wrist swelling', 'Arm stiffness or tightness', 'Arm swelling']","['hand-or-finger-pain', 'wrist-pain', 'hand-or-finger-swelling', 'arm-pain', 'wrist-swelling', 'arm-stiffness-or-tightness', 'arm-swelling']","[71, 67, 39, 23, 12, 4, 4]","Condition: Fracture of the hand. Patient reports: Hand or finger pain, Wrist pain, Hand or finger swelling, Arm pain, Wrist swelling, Arm stiffness or tightness, Arm swelling.",7,71,31.428571428571427,0,0,0,self_monitor,False,27,0
Osteoporosis,osteoporosis,"['Back pain', 'Hip pain', 'Joint pain', 'Bones are painful', 'Disturbance of memory', 'Muscle cramps, contractures, or spasms', 'Stomach bloating']","['back-pain', 'hip-pain', 'joint-pain', 'bones-are-painful', 'disturbance-of-memory', 'muscle-cramps-contractures-or-spasms', 'stomach-bloating']","[36, 20, 15, 10, 7, 5, 4]","Condition: Osteoporosis. Patient reports: Back pain, Hip pain, Joint pain, Bones are painful, Disturbance of memory, Muscle cramps, contractures, or spasms, Stomach bloating.",7,36,13.857142857142858,0,2,1,consult_gp,False,23,1
Yeast infection,yeast-infection,"['Vaginal itching', 'Vaginal discharge', 'Skin rash', 'Diaper rash', 'Sharp abdominal pain', 'Itching of skin', 'Suprapubic pain']","['vaginal-itching', 'vaginal-discharge', 'skin-rash', 'diaper-rash', 'sharp-abdominal-pain', 'itching-of-skin', 'suprapubic-pain']","[62, 58, 52, 31, 29, 29, 23]","Condition: Yeast infection. Patient reports: Vaginal itching, Vaginal discharge, Skin rash, Diaper rash, Sharp abdominal pain, Itching of skin, Suprapubic pain.",7,62,40.57142857142857,0,2,0,consult_gp,False,21,1
Pelvic inflammatory disease,pelvic-inflammatory-disease,"['Sharp abdominal pain', 'Pelvic pain', 'Lower abdominal pain', 'Vaginal discharge', 'Nausea', 'Vomiting', 'Side pain']","['sharp-abdominal-pain', 'pelvic-pain', 'lower-abdominal-pain', 'vaginal-discharge', 'nausea', 'vomiting', 'side-pain']","[84, 60, 57, 56, 34, 30, 25]","Condition: Pelvic inflammatory disease. Patient reports: Sharp abdominal pain, Pelvic pain, Lower abdominal pain, Vaginal discharge, Nausea, Vomiting, Side pain.",7,84,49.42857142857143,0,2,0,consult_gp,False,20,1
Sickle cell anemia,sickle-cell-anemia,"['Ache all over', 'Leg pain', 'Fever', 'Back pain', 'Joint pain', 'Pulling at ears', 'Temper problems']","['ache-all-over', 'leg-pain', 'fever', 'back-pain', 'joint-pain', 'pulling-at-ears', 'temper-problems']","[42, 37, 29, 26, 10, 7, 4]","Condition: Sickle cell anemia. Patient reports: Ache all over, Leg pain, Fever, Back pain, Joint pain, Pulling at ears, Temper problems.",7,42,22.142857142857142,0,3,0,consult_gp,False,21,1
Scoliosis,scoliosis,"['Back pain', 'Low back pain', 'Leg pain', 'Problems with movement', 'Lower body pain', 'Leg weakness', 'Knee swelling']","['back-pain', 'low-back-pain', 'leg-pain', 'problems-with-movement', 'lower-body-pain', 'leg-weakness', 'knee-swelling']","[66, 51, 31, 16, 8, 4, 4]","Condition: Scoliosis. Patient reports: Back pain, Low back pain, Leg pain, Problems with movement, Lower body pain, Leg weakness, Knee swelling.",7,66,25.714285714285715,1,1,0,urgent,False,21,2
Allergy,allergy,"['Skin rash', 'Allergic reaction', 'Itching of skin', 'Peripheral edema', 'Abnormal appearing skin', 'Cough', 'Swollen eye']","['skin-rash', 'allergic-reaction', 'itching-of-skin', 'peripheral-edema', 'abnormal-appearing-skin', 'cough', 'swollen-eye']","[85, 65, 61, 28, 27, 26, 24]","Condition: Allergy. Patient reports: Skin rash, Allergic reaction, Itching of skin, Peripheral edema, Abnormal appearing skin, Cough, Swollen eye.",7,85,45.142857142857146,0,2,0,consult_gp,False,19,1
Dysthymic disorder,dysthymic-disorder,"['Depression', 'Anxiety and nervousness', 'Depressive or psychotic symptoms', 'Insomnia', 'Excessive anger', 'Low self-esteem', 'Disturbance of memory']","['depression', 'anxiety-and-nervousness', 'depressive-or-psychotic-symptoms', 'insomnia', 'excessive-anger', 'low-self-esteem', 'disturbance-of-memory']","[76, 72, 44, 22, 7, 7, 6]","Condition: Dysthymic disorder. Patient reports: Depression, Anxiety and nervousness, Depressive or psychotic symptoms, Insomnia, Excessive anger, Low self-esteem, Disturbance of memory.",7,76,33.42857142857143,0,0,0,self_monitor,False,21,0
Esophageal cancer,esophageal-cancer,"['Fatigue', 'Ache all over', 'Weakness', 'Sharp abdominal pain', 'Vomiting', 'Shortness of breath', 'Difficulty in swallowing']","['fatigue', 'ache-all-over', 'weakness', 'sharp-abdominal-pain', 'vomiting', 'shortness-of-breath', 'difficulty-in-swallowing']","[32, 32, 32, 32, 32, 28, 28]","Condition: Esophageal cancer. Patient reports: Fatigue, Ache all over, Weakness, Sharp abdominal pain, Vomiting, Shortness of breath, Difficulty in swallowing.",7,32,30.857142857142858,1,3,0,urgent,False,20,2
Air embolism,air-embolism,"['Pain in eye', 'Shoulder cramps or spasms', 'Facial pain', 'Ankle pain', 'Wrist pain', 'Pain during pregnancy', 'Excessive anger']","['pain-in-eye', 'shoulder-cramps-or-spasms', 'facial-pain', 'ankle-pain', 'wrist-pain', 'pain-during-pregnancy', 'excessive-anger']","[91, 91, 91, 91, 91, 91, 91]","Condition: Air embolism. Patient reports: Pain in eye, Shoulder cramps or spasms, Facial pain, Ankle pain, Wrist pain, Pain during pregnancy, Excessive anger.",7,91,91.0,0,0,0,self_monitor,False,23,0
Acute glaucoma,acute-glaucoma,"['Diminished vision', 'Pain in eye', 'Symptoms of eye', 'Eye redness', 'Spots or clouds in vision', 'Foreign body sensation in eye', 'Itchiness of eye']","['diminished-vision', 'pain-in-eye', 'symptoms-of-eye', 'eye-redness', 'spots-or-clouds-in-vision', 'foreign-body-sensation-in-eye', 'itchiness-of-eye']","[62, 41, 36, 28, 22, 18, 18]","Condition: Acute glaucoma. Patient reports: Diminished vision, Pain in eye, Symptoms of eye, Eye redness, Spots or clouds in vision, Foreign body sensation in eye, Itchiness of eye.",7,62,32.142857142857146,0,0,0,self_monitor,False,28,0
